CODIGO;DESCRICAO
7771;CARPINTEIROS NAVAIS
7772;CARPINTEIROS DE CARROCERIAS E CARRETAS
7801;SUPERVISORES DE TRABALHADORES DE EMBALAGEM E ETIQUETAGEM
7811;CONDUTORES DE PROCESSOS ROBOTIZADOS
7813;OPERADORES DE VEÍCULOS SUBAQUÁTICOS CONTROLADOS REMOTAMENTE
7817;TRABALHADORES SUBAQUÁTICOS
7821;OPERADORES DE MÁQUINAS E EQUIPAMENTOS DE ELEVAÇÃO
7822;OPERADORES DE EQUIPAMENTOS DE MOVIMENTAÇÃO DE CARGAS
7823;MOTORISTAS DE VEÍCULOS DE PEQUENO E MÉDIO PORTE
7824;MOTORISTAS DE ÔNIBUS URBANOS, METROPOLITANOS E RODOVIÁRIOS
7825;MOTORISTAS DE VEÍCULOS DE CARGAS EM GERAL
7826;OPERADORES DE VEÍCULOS SOBRE TRILHOS E CABOS AÉREOS
7827;TRABALHADORES AQUAVIÁRIOS
7828;CONDUTORES DE ANIMAIS E DE VEÍCULOS DE TRAÇÃO ANIMAL E PEDAIS
7831;TRABALHADORES DE MANOBRAS DE TRANSPORTES SOBRE TRILHOS
7832;TRABALHADORES DE CARGAS E DESCARGAS DE MERCADORIAS
7841;TRABALHADORES DE EMBALAGEM E DE ETIQUETAGEM
7842;ALIMENTADORES DE LINHAS DE PRODUÇÃO
7911;ARTESÃOS
8101;SUPERVISORES DE PRODUÇÃO EM INDÚSTRIAS QUÍMICAS, PETROQUÍMICAS E AFINS
8102;SUPERVISORES DE PRODUÇÃO EM INDÚSTRIAS DE TRANSFORMAÇÃO DE PLÁSTICOS E BORRACHAS
8103;SUPERVISORES DE PRODUÇÃO EM INDÚSTRIAS DE PRODUTOS FARMACÊUTICOS, COSMÉTICOS E AFINS
8110;OPERADORES POLIVALENTES DE EQUIPAMENTOS EM INDÚSTRIAS QUÍMICAS, PETROQUÍMICAS E AFINS
8111;OPERADORES DE EQUIPAMENTOS DE MOAGEM E MISTURA DE MATERIAIS (TRATAMENTOS QUÍMICOS E AFIN
8112;OPERADORES DE CALCINAÇÃO E DE TRATAMENTOS QUÍMICOS DE MATERIAIS RADIOATIVOS
8113;OPERADORES DE EQUIPAMENTOS DE FILTRAGEM E SEPARAÇÃO
8114;OPERADORES DE EQUIPAMENTOS DE DESTILAÇÃO, EVAPORAÇÃO E REAÇÃO
8115;OPERADORES DE EQUIPAMENTOS DE PRODUÇÃO E REFINO DE PETRÓLEO E GÁS
8116;OPERADORES DE EQUIPAMENTOS DE COQUEIFICAÇÃO
8117;OPERADORES DE INSTALAÇÕES E MÁQUINAS DE PRODUTOS PLÁSTICOS, DE BORRACHA E MOLDADORES D
8118;OPERADORES DE MÁQUINAS E INSTALAÇÕES DE PRODUTOS FARMACÊUTICOS, COSMÉTICOS E AFINS
8121;TRABALHADORES DA FABRICAÇÃO DE MUNIÇÃO E EXPLOSIVOS QUÍMICOS
8131;OPERADORES DE PROCESSOS DAS INDÚSTRIAS DE TRANSFORMAÇÃO DE PRODUTOS QUÍMICOS,
8181;LABORATORISTAS INDUSTRIAIS AUXILIARES
8201;SUPERVISORES DE PRODUÇÃO EM INDÚSTRIAS SIDERÚRGICAS
8202;SUPERVISORES NA FABRICAÇÃO DE MATERIAIS PARA CONSTRUÇÃO (VIDROS E CERÂMICAS)
8211;OPERADORES DE INSTALAÇÕES DE SINTERIZAÇÃO
8212;OPERADORES DE FORNOS DE PRIMEIRA FUSÃO E ACIARIA
8213;OPERADORES DE EQUIPAMENTOS DE LAMINAÇÃO
8214;OPERADORES DE EQUIPAMENTOS DE ACABAMENTO DE CHAPAS E METAIS
8221;FORNEIROS METALÚRGICOS (SEGUNDA FUSÃO E REAQUECIMENTO)
8231;OPERADORES NA PREPARAÇÃO DE MASSAS PARA ABRASIVO, VIDRO, CERÂMICA, PORCELANA E MATERIAIS
8232;OPERADORES DE EQUIPAMENTOS DE FABRICAÇÃO E BENEFICIAMENTO DE CRISTAIS, VIDROS, CERÂMICAS
8233;OPERADORES DE INSTALAÇÕES E EQUIPAMENTOS DE FABRICAÇÃO DE MATERIAIS DE CONSTRUÇÃO
8281;TRABALHADORES DA FABRICAÇÃO DE CERÂMICA ESTRUTURAL PARA CONSTRUÇÃO
8301;SUPERVISORES DA FABRICAÇÃO DE CELULOSE E PAPEL
8311;PREPARADORES DE PASTA PARA FABRICAÇÃO DE PAPEL
8321;OPERADORES DE MÁQUINAS DE FABRICAR PAPEL E PAPELÃO
8331;OPERADORES DE MÁQUINAS NA FABRICAÇÃO DE PRODUTOS DE PAPEL E PAPELÃO
8332;TRABALHADORES ARTESANAIS DE PRODUTOS DE PAPEL E PAPELÃO
8401;SUPERVISORES DA FABRICAÇÃO DE ALIMENTOS, BEBIDAS E FUMO
8411;TRABALHADORES DA INDÚSTRIA DE BENEFICIAMENTO DE GRÃOS, CEREAIS E AFINS
8412;TRABALHADORES NO BENEFICIAMENTO DO SAL
8413;TRABALHADORES NA FABRICAÇÃO E REFINO DE AÇÚCAR
8414;TRABALHADORES NA FABRICAÇÃO E CONSERVAÇÃO DE ALIMENTOS
8415;TRABALHADORES NA PASTEURIZAÇÃO DO LEITE E NA FABRICAÇÃO DE LATICÍNIOS E AFINS
8416;TRABALHADORES NA INDUSTRIALIZAÇÃO DE CAFÉ, CACAU, MATE E DE PRODUTOS AFINS
8417;TRABALHADORES NA FABRICAÇÃO DE CACHAÇA, CERVEJA, VINHOS E OUTRAS BEBIDAS
8418;OPERADORES DE EQUIPAMENTOS NA FABRICAÇÃO DE PÃES, MASSAS ALIMENTÍCIAS, DOCES, CHOCOLATES
8421;CIGARREIROS E BENEFICIADORES DE FUMO
8422;CHARUTEIROS
8481;TRABALHADORES ARTESANAIS NA CONSERVAÇÃO DE ALIMENTOS
8482;TRABALHADORES ARTESANAIS NA PASTEURIZAÇÃO DO LEITE E NA FABRICAÇÃO DE LATICÍNIOS E AFINS
8483;PADEIROS, CONFEITEIROS E AFINS
8484;TRABALHADORES NA DEGUSTAÇÃO E CLASSIFICAÇÃO DE GRÃOS E AFINS
8485;MAGAREFES E AFINS
8486;TRABALHADORES ARTESANAIS NA INDÚSTRIA DO FUMO
8601;SUPERVISORES DA PRODUÇÃO DE UTILIDADES
8611;OPERADORES DE INSTALAÇÕES DE GERAÇÃO E DISTRIBUIÇÃO DE ENERGIA ELÉTRICA, HIDRÁULICA, TÉRMIC
8612;OPERADORES DE INSTALAÇÕES DE DISTRIBUIÇÃO DE ENERGIA ELÉTRICA
8621;OPERADORES DE MÁQUINAS A VAPOR E UTILIDADES
8622;OPERADORES DE INSTALAÇÕES DE CAPTAÇÃO, TRATAMENTO E DISTRIBUIÇÃO DE ÁGUA
8623;OPERADORES DE INSTALAÇÕES DE CAPTAÇÃO E ESGOTOS
8624;OPERADORES DE INSTALAÇÕES DE EXTRAÇÃO, PROCESSAMENTO, ENVASAMENTO E DISTRIBUIÇÃO DE GAS
8625;OPERADORES DE INSTALAÇÕES DE REFRIGERAÇÃO E AR-CONDICIONADO
9101;SUPERVISORES EM SERVIÇOS DE REPARAÇÃO E MANUTENÇÃO DE MÁQUINAS E EQUIPAMENTOS INDUSTRI
9102;SUPERVISORES EM SERVIÇOS DE REPARAÇÃO E MANUTENÇÃO VEICULAR
9109;SUPERVISORES DE OUTROS TRABALHADORES DE SERVIÇOS DE REPARAÇÃO, CONSERVAÇÃO E MANUTENÇ
9111;MECÂNICOS DE MANUTENÇÃO DE BOMBAS, MOTORES, COMPRESSORES E EQUIPAMENTOS DE TRANSMISSÃ
9112;MECÂNICOS DE MANUTENÇÃO E INSTALAÇÃO DE APARELHOS DE CLIMATIZAÇÃO E REFRIGERAÇÃO
9113;MECÂNICOS DE MANUTENÇÃO DE MÁQUINAS INDUSTRIAIS
9131;MECÂNICOS DE MANUTENÇÃO DE MÁQUINAS PESADAS E EQUIPAMENTOS AGRÍCOLAS
9141;MECÂNICOS DE MANUTENÇÃO AERONÁUTICA
9142;MECÂNICOS DE MANUTENÇÃO DE MOTORES E EQUIPAMENTOS NAVAIS
9143;MECÂNICOS DE MANUTENÇÃO METROFERROVIÁRIA
9144;MECÂNICOS DE MANUTENÇÃO DE VEÍCULOS AUTOMOTORES
9151;TÉCNICOS EM MANUTENÇÃO E REPARAÇÃO DE INSTRUMENTOS DE MEDIÇÃO E PRECISÃO
9152;RESTAURADORES DE INSTRUMENTOS MUSICAIS
9153;TÉCNICOS EM MANUTENÇÃO E REPARAÇÃO DE EQUIPAMENTOS BIOMÉDICOS
9154;REPARADORES DE EQUIPAMENTOS FOTOGRÁFICOS
9191;LUBRIFICADORES
9192;TRABALHADORES DE MANUTENÇÃO DE ROÇADEIRAS, MOTOSERRAS E SIMILARES
9193;MECÂNICOS DE MANUTENÇÃO DE BICICLETAS E EQUIPAMENTOS ESPORTIVOS E DE GINÁSTICA
9501;SUPERVISORES DE MANUTENÇÃO ELETROELETRÔNICA INDUSTRIAL, COMERCIAL E PREDIAL
9502;SUPERVISORES DE MANUTENÇÃO ELETROELETRÔNICA VEICULAR
9503;SUPERVISORES DE MANUTENÇÃO ELETROMECÂNICA
9511;ELETRICISTAS DE MANUTENÇÃO ELETROELETRÔNICA
9513;INSTALADORES E MANTENEDORES DE SISTEMAS ELETROELETRÔNICOS DE SEGURANÇA
9531;ELETRICISTAS ELETRÔNICOS DE MANUTENÇÃO VEICULAR (AÉREA, TERRESTRE E NAVAL)
9541;INSTALADORES E MANTENEDORES ELETROMECÂNICOS DE ELEVADORES, ESCADAS E PORTAS AUTOMÁTIC
9542;REPARADORES DE APARELHOS ELETRODOMÉSTICOS
9543;REPARADORES DE EQUIPAMENTOS DE ESCRITÓRIO
9911;CONSERVADORES DE VIAS PERMANENTES (TRILHOS)
9912;MANTENEDORES DE EQUIPAMENTOS DE PARQUES DE DIVERSÕES E SIMILARES
9913;REPARADORES DE CARROCERIAS DE VEÍCULOS
9921;TRABALHADORES ELEMENTARES DE SERVIÇOS DE MANUTENÇÃO VEICULAR
9922;TRABALHADORES OPERACIONAIS DE CONSERVAÇÃO DE VIAS PERMANENTES (EXCETO TRILHOS)
